{
  "$schema": "https://json-schema.org/draft/2020-12/schema",
  "$id": "https://project-42.dev/schemas/content-maintenance/content-change-packet-1.0.json",
  "title": "Project 42 content-change packet",
  "type": "object",
  "additionalProperties": false,
  "required": [
    "schemaVersion",
    "id",
    "createdAt",
    "observations",
    "claims",
    "impact",
    "disposition"
  ],
  "properties": {
    "schemaVersion": { "const": "1.0" },
    "id": { "$ref": "#/$defs/stableId" },
    "createdAt": { "$ref": "#/$defs/timestamp" },
    "observations": {
      "type": "array",
      "minItems": 1,
      "items": { "$ref": "#/$defs/observation" }
    },
    "claims": {
      "type": "array",
      "items": { "$ref": "#/$defs/claim" }
    },
    "impact": { "$ref": "#/$defs/impact" },
    "disposition": {
      "enum": ["no-change", "ready-for-draft", "blocked"]
    }
  },
  "$defs": {
    "stableId": {
      "type": "string",
      "pattern": "^[a-z0-9][a-z0-9._-]{2,127}$"
    },
    "timestamp": {
      "type": "string",
      "pattern": "^\\d{4}-\\d{2}-\\d{2}T\\d{2}:\\d{2}:\\d{2}(?:\\.\\d{3})?Z$"
    },
    "digest": {
      "type": "string",
      "pattern": "^[a-f0-9]{64}$"
    },
    "stringIds": {
      "type": "array",
      "uniqueItems": true,
      "items": { "$ref": "#/$defs/stableId" }
    },
    "observation": {
      "type": "object",
      "additionalProperties": false,
      "required": [
        "id",
        "sourceId",
        "canonicalUrl",
        "retrievedAt",
        "previousHash",
        "currentHash",
        "changed",
        "boundedDiff"
      ],
      "properties": {
        "id": { "$ref": "#/$defs/stableId" },
        "sourceId": { "$ref": "#/$defs/stableId" },
        "canonicalUrl": {
          "type": "string",
          "pattern": "^https://"
        },
        "retrievedAt": { "$ref": "#/$defs/timestamp" },
        "previousHash": { "$ref": "#/$defs/digest" },
        "currentHash": { "$ref": "#/$defs/digest" },
        "changed": { "type": "boolean" },
        "boundedDiff": {
          "type": "array",
          "items": {
            "type": "object",
            "additionalProperties": false,
            "required": ["section", "before", "after"],
            "properties": {
              "section": { "type": "string", "minLength": 1, "maxLength": 200 },
              "before": { "type": "string", "maxLength": 2000 },
              "after": { "type": "string", "maxLength": 2000 }
            }
          }
        }
      }
    },
    "claim": {
      "type": "object",
      "additionalProperties": false,
      "required": [
        "id",
        "statement",
        "volatility",
        "verificationState",
        "evidence",
        "affectedContentIds",
        "affectedAssessmentIds"
      ],
      "properties": {
        "id": { "$ref": "#/$defs/stableId" },
        "statement": { "type": "string", "minLength": 1, "maxLength": 4000 },
        "volatility": { "enum": ["stable", "volatile"] },
        "verificationState": {
          "enum": ["supported", "contradicted", "ambiguous", "missing"]
        },
        "evidence": {
          "type": "array",
          "items": {
            "type": "object",
            "additionalProperties": false,
            "required": ["observationId", "excerpt", "relation"],
            "properties": {
              "observationId": { "$ref": "#/$defs/stableId" },
              "excerpt": { "type": "string", "minLength": 1, "maxLength": 1000 },
              "relation": { "enum": ["supports", "contradicts"] }
            }
          }
        },
        "affectedContentIds": { "$ref": "#/$defs/stringIds" },
        "affectedAssessmentIds": { "$ref": "#/$defs/stringIds" }
      }
    },
    "impact": {
      "type": "object",
      "additionalProperties": false,
      "required": [
        "learnModuleIds",
        "fieldGuideResourceIds",
        "assessmentQuestionIds",
        "instructorPackageModuleIds"
      ],
      "properties": {
        "learnModuleIds": { "$ref": "#/$defs/stringIds" },
        "fieldGuideResourceIds": { "$ref": "#/$defs/stringIds" },
        "assessmentQuestionIds": { "$ref": "#/$defs/stringIds" },
        "instructorPackageModuleIds": { "$ref": "#/$defs/stringIds" }
      }
    }
  }
}
